{
  "oacpVersion": "0.1",
  "messageId": "msg_valid_001",
  "messageKind": "EVENT",
  "messageType": "RUN_STARTED",
  "createdAt": "2026-05-05T17:00:00Z",
  "scope": {
    "scopeType": "TENANT",
    "tenantId": "tenant_001",
    "environment": "production"
  },
  "from": {
    "identity": {
      "assurance": "AUTHENTICATED",
      "subject": "principal.runtime.ojas",
      "credentialRef": "cred_runtime",
      "credentialKind": "RUNTIME_TOKEN",
      "issuedAt": "2026-05-05T16:00:00Z",
      "expiresAt": "2026-05-05T22:00:00Z",
      "issuedBy": "runtime-adapter-001"
    },
    "verification": {
      "verified": true,
      "verifiedBy": "runtime-adapter-001",
      "verifiedAt": "2026-05-05T17:00:00Z",
      "verificationMethod": "RUNTIME_INTERNAL",
      "tenantScope": {
        "authorizedTenants": ["tenant_001"],
        "source": "credential-claims"
      }
    },
    "participantId": "runtime.ojas",
    "participantType": "RUNTIME"
  },
  "governance": {
    "profile": "OACP-Operational",
    "profileVersion": "0.1.0"
  },
  "run": {
    "runId": "run_001",
    "correlationId": "corr_001"
  },
  "causation": {
    "causationType": "INITIATOR"
  },
  "payloadType": "run-started-v1",
  "payload": {
    "runId": "run_001",
    "startedAt": "2026-05-05T17:00:00Z"
  }
}
