{
  "oacpVersion": "0.1",
  "messageId": "msg_proposal_001",
  "messageKind": "PROPOSAL",
  "messageType": "PROPOSAL_EMITTED",
  "createdAt": "2026-05-05T17:10:00Z",
  "scope": {
    "scopeType": "TENANT",
    "tenantId": "tenant_001",
    "environment": "production"
  },
  "from": {
    "identity": {
      "assurance": "AUTHENTICATED",
      "subject": "principal.agent.classifier",
      "credentialRef": "cred_agent_classifier",
      "credentialKind": "RUNTIME_TOKEN",
      "issuedAt": "2026-05-05T16:00:00Z",
      "expiresAt": "2026-05-05T22:00:00Z",
      "issuedBy": "runtime-adapter-001"
    },
    "verification": {
      "verified": true,
      "verifiedBy": "runtime-adapter-001",
      "verifiedAt": "2026-05-05T17:10:00Z",
      "verificationMethod": "RUNTIME_INTERNAL",
      "tenantScope": {
        "authorizedTenants": ["tenant_001"],
        "source": "credential-claims"
      }
    },
    "participantId": "agent.classifier",
    "participantType": "AGENT"
  },
  "governance": {
    "profile": "OACP-Governed",
    "profileVersion": "0.1.0",
    "bindingId": "bind_001",
    "policySnapshotId": "policy-snapshot-001"
  },
  "run": {
    "runId": "run_001",
    "correlationId": "corr_001"
  },
  "conversation": {
    "conversationId": "conv_001"
  },
  "causation": {
    "causationType": "LINEAR",
    "causationId": "msg_run1_init",
    "causationIds": ["msg_run1_init"]
  },
  "authorizationDecision": {
    "decisionRef": {
      "decisionId": "authz_proposal_001",
      "decisionType": "AUTHORIZATION",
      "decidedBy": "policy-engine-001",
      "decidedAt": "2026-05-05T17:10:00Z",
      "tenantId": "tenant_001"
    },
    "decidedBy": "policy-engine-001",
    "decidedAt": "2026-05-05T17:10:00Z",
    "scope": {
      "messageType": "PROPOSAL_EMITTED",
      "bindingId": "bind_001",
      "runId": "run_001",
      "tenantId": "tenant_001"
    },
    "result": "ALLOW",
    "policySnapshotId": "policy-snapshot-001"
  },
  "payloadType": "proposal-v1",
  "payload": {
    "proposalId": "prop_001",
    "proposalRef": {
      "artifactId": "prop_001",
      "artifactType": "PROPOSAL",
      "uri": "ojas://tenant_001/proposals/prop_001",
      "mimeType": "application/json",
      "hash": "sha256:b1ce3f5d2a4e7c1f8b6d9e3a5c7f2b4d6e8a1c3f5d7e9b2a4c6f8d1e3a5b7c9f",
      "sizeBytes": 4096,
      "createdAt": "2026-05-05T17:10:00Z",
      "expiresAt": "2026-05-05T19:10:00Z",
      "tenantId": "tenant_001"
    },
    "summary": {
      "proposalStatus": "EMITTED",
      "proposedBy": {
        "participantId": "agent.classifier",
        "participantType": "AGENT",
        "bindingId": "bind_001"
      },
      "calibration": {
        "confidence": 0.96,
        "calibrationMethod": "TEMPERATURE_SCALED"
      }
    },
    "tenantId": "tenant_001",
    "runId": "run_001",
    "conversationId": "conv_001"
  }
}
